ROLLBACK

mysql> set autocommit=off;
Query OK, 0 rows affected (0.00 sec)


mysql> select * from customer;
+------+-------+-----------------+------------+------------+
| id   | name  | address         | city       | ph_no      |
+------+-------+-----------------+------------+------------+
| 1001 | Raju  | abc house       | Kozhikode  | 9876543210 |
| 1002 | Ramu  | def house       | Kozhikode  | 6754328970 |
| 1003 | Ramu  | def house       | Kozhikode  | 6754328970 |
| 1004 | Paru  | Manjummel house | Eranakulam | 8877665544 |
| 1005 | Hamza | klm house       | palakkad   | 9447879742 |
| 1006 | babu  | pol house       | kannur     | 7895439898 |
+------+-------+-----------------+------------+------------+
6 rows in set (0.00 sec)

mysql> delete from customer where id=1006;
Query OK, 1 row affected (0.02 sec)

mysql> select * from customer;
+------+-------+-----------------+------------+------------+
| id   | name  | address         | city       | ph_no      |
+------+-------+-----------------+------------+------------+
| 1001 | Raju  | abc house       | Kozhikode  | 9876543210 |
| 1002 | Ramu  | def house       | Kozhikode  | 6754328970 |
| 1003 | Ramu  | def house       | Kozhikode  | 6754328970 |
| 1004 | Paru  | Manjummel house | Eranakulam | 8877665544 |
| 1005 | Hamza | klm house       | palakkad   | 9447879742 |
+------+-------+-----------------+------------+------------+
5 rows in set (0.00 sec)

mysql> rollback;
Query OK, 0 rows affected (0.05 sec)

mysql> select * from customer;
+------+-------+-----------------+------------+------------+
| id   | name  | address         | city       | ph_no      |
+------+-------+-----------------+------------+------------+
| 1001 | Raju  | abc house       | Kozhikode  | 9876543210 |
| 1002 | Ramu  | def house       | Kozhikode  | 6754328970 |
| 1003 | Ramu  | def house       | Kozhikode  | 6754328970 |
| 1004 | Paru  | Manjummel house | Eranakulam | 8877665544 |
| 1005 | Hamza | klm house       | palakkad   | 9447879742 |
| 1006 | babu  | pol house       | kannur     | 7895439898 |
+------+-------+-----------------+------------+------------+
6 rows in set (0.00 sec)


GRANT 


mysql> create user mysql> show grants for Abhii1@'localhost';
+--------------------------------------------------------------+
| Grants for Abhii1@localhost                                  |
+--------------------------------------------------------------+
| GRANT USAGE ON *.* TO `Abhii1`@`localhost`                   |
| GRANT UPDATE ON `invoice`.`customer` TO `Abhii1`@`localhost` |
+--------------------------------------------------------------+
2 rows in set (0.00 sec)
Abhii@'localhost' identified by 'qwerty';
Query OK, 0 rows affected (0.22 sec)

mysql> create user Abhii1@'localhost' identified by 'zxcvb';
Query OK, 0 rows affected (0.50 sec)

mysql> grant select on invoice.customer to Abhii@'localhost';
Query OK, 0 rows affected (0.54 sec)

mysql> show grants for Abhii@'localhost';
+-------------------------------------------------------------+
| Grants for Abhii@localhost                                  |
+-------------------------------------------------------------+
| GRANT USAGE ON *.* TO `Abhii`@`localhost`                   |
| GRANT SELECT ON `invoice`.`customer` TO `Abhii`@`localhost` |
+-------------------------------------------------------------+

mysql> grant select on invoice.customer to Abhii1@'localhost';
Query OK, 0 rows affected (0.09 sec)

mysql> grant update on invoice.customer to Abhii1@'localhost';
Query OK, 0 rows affected (0.09 sec)

mysql> show grants for Abhii1@'localhost';
+----------------------------------------------------------------------+
| Grants for Abhii1@localhost                                          |
+----------------------------------------------------------------------+
| GRANT USAGE ON *.* TO `Abhii1`@`localhost`                           |
| GRANT SELECT, UPDATE ON `invoice`.`customer` TO `Abhii1`@`localhost` |
+----------------------------------------------------------------------+
2 rows in set (0.00 sec)

REVOKE

mysql> revoke select on invoice.customer from Abhii1@'localhost';
Query OK, 0 rows affected (0.54 sec)

mysql> show grants for Abhii1@'localhost';
+--------------------------------------------------------------+
| Grants for Abhii1@localhost                                  |
+--------------------------------------------------------------+
| GRANT USAGE ON *.* TO `Abhii1`@`localhost`                   |
| GRANT UPDATE ON `invoice`.`customer` TO `Abhii1`@`localhost` |
+--------------------------------------------------------------+
2 rows in set (0.00 sec)

//VERIFIED
